{
    "summary": "Assessment of the DFIR-Agentic project against the 5 Multi-Agent Orchestration Principles.",
    "root_cause": "The project represents a highly mature framework for agentic digital forensics. It strongly adheres to Context Isolation, Sequential Handoffs, Delegation Contracts, and Convergence via its MCP architecture and findings contracts. However, Task Decomposition & Parallel Dispatch is currently implemented as sequential blocking calls in auto_run.py rather than true parallel execution.",
    "confidence": "High",
    "claims": [
        {
            "claim": "Parallel Dispatch is not fully implemented.",
            "supporting_evidence": [
                "tools/router/auto_run.py uses synchronous run_must() blocking calls for pipeline execution instead of async or thread pools."
            ]
        },
        {
            "claim": "Strict Context Isolation is strongly enforced.",
            "supporting_evidence": [
                "adapters/* scripts translate raw CSV outputs (Hayabusa, Timeline) into standardized findings.schema.json.",
                "deepseek_orchestrator.py implements a 100KB limit and context compaction module."
            ]
        },
        {
            "claim": "Sequential Handoffs and Delegation Contracts are strictly observed.",
            "supporting_evidence": [
                "Specialized subagents are implemented as distinct MCP servers (dfir, win, mem) exposing bounded tools like dfir.query_findings@1.",
                "auto_run.py sequentially pipes evidence through identification, ingestion, enrichment, and merging."
            ]
        },
        {
            "claim": "Convergence & Synthesis protocol is cryptographically enforced.",
            "supporting_evidence": [
                "deepseek_orchestrator.py check_for_rca() guarantees a schema-compliant root_cause_analysis.json before successful task completion."
            ]
        }
    ],
    "unknowns": [
        "Whether future roadmap plans include true asynchronous orchestrator dispatching for subagents."
    ],
    "mitre_attack_mapping": [],
    "assessment": "The DFIR-Agentic project excellently implements 4 out of 5 Orchestration Principles. To achieve full compliance with Principle 1, the ingestion pipelines in `auto_run.py` (e.g., mftecmd, rbcmd, lecmd) should be dispatched via `concurrent.futures` or `asyncio.gather` for true parallelism."
}